,index,input,head,relation,tail
671,603,RAN ONE TANK DRY EN ROUTE. FUEL SELECTOR WOULD NOT MOVE TO OTHER TANK. LANDED ON A ROAD. FUEL SELECTOR LACKED LUBE.,taxi,subclass of,takeoff
672,604,"PILOT FORGOT TO REMOVE AILERON/ELEVATOR CONTROL LOCK, AIRCRAFT ROLLED INVERTED AND CRASHED AFTER TAKEOFF.          ",seat,use,takeoff
673,605,MAINTENANCE PUT AIRCRAFT ON FLIGHT LINE WITH GEAR DOORS OPEN. PILOT FAILED TO REMEMDY PRIOR TO TAXI FOR TAKEOFF.   ,crashed and turned,item operated,helicopter
674,606,SEAT WAS NOT PROPERLY SECURED AND SLID FULL AFT DURING TAKEOFF CAUSING CRASH.                                      ,runway,use,takeoff
675,607,REAR OF SKID CAUGHT UNDER BOARDWALK ON ATTEMPTED TAKEOFF. HELICOPTER CRASHED AND TURNED. PILOTS STORY DIFFERS.     ,runway,part of,aircraft
676,608,"ENGINE QUIT ON TAKEOFF, LANDED ON REMAINING RUNWAY, RAN OFF INTO A DITCH FOUND CARBURETOR FULL OF WATER.           ",cowling,part of,engine
677,609,"VIBRATION AFTER LIFTOFF. UNABLE TO CLIMB. LANDED ON GRASS NEAR RUNWAY, STRUCK FENCE. ICE & SNOW ON AIRCRAFT.       ",oil cap,part of,engine
678,610,ENGINE OVERHEATED ON CLIMBOUT. PILOT REMEMBERED HE FORGOT TO REMOVE ENGINE COWLING BIRD PLUGS.                     ,pilot,item operated,cabin
679,610,ENGINE OVERHEATED ON CLIMBOUT. PILOT REMEMBERED HE FORGOT TO REMOVE ENGINE COWLING BIRD PLUGS.                     ,cabin,operator,pilot
680,611,PILOT REPORTED LOSS OF OIL IN ENGINE AND DIVERTED TO MEMPHIS. FOUND OIL TANK CAP MISSING. OIL CAP 315510704.       ,elevator,part of,runway
681,612,PILOT FAILED TO SECURE CABIN DOOR. DOOR OPENED IN FLIGHT DUE TO TURBULENCE. MADE PRECAUTIONARY LANDING.            ,pilot,item operated,glider
682,612,PILOT FAILED TO SECURE CABIN DOOR. DOOR OPENED IN FLIGHT DUE TO TURBULENCE. MADE PRECAUTIONARY LANDING.            ,glider,operator,pilot
683,613,"FAILED TO CLIMB ON LIFTOFF. ABORTED, BOUNCED OFF END OF RUNWAY. PILOT HAD ELEVATOR TRIM IN NOSE DOWN RANGE.        ",overrun,subclass of,aborted
684,614,PILOT ATTEMPTED TO ADJUST RUDDER PEDALS DURING CLIMB AND RELEASED GLIDER TOW ROPE. CRASHED DURING EMERGENCY LANDING,ifr,subclass of,jet fuel
685,615,"ENGINE MISSED ON TAKEOFF ROLL, ABORTED, RAN OFF END OF RUNWAY. HIT DITCH IN OVERRUN. OUTSIDE STORAGE, WATER IN FUEL",aileron,used by,pilot
686,616,LOST BOTH ENGINES ON AN IFR CLIMBOUT. CRASHED INTO TREES AND BURNED TRYING TO RETURN. WAS SERVICED WITH JET FUEL.  ,parking brake,part of,brake system
687,616,LOST BOTH ENGINES ON AN IFR CLIMBOUT. CRASHED INTO TREES AND BURNED TRYING TO RETURN. WAS SERVICED WITH JET FUEL.  ,brake system,has part,parking brake
688,617,PILOT FORGOT TO REMOVE CONTROL LOCK ON AILERON AND COULN'T CONTROL AIRCRAFT DURING LANDING.                        ,elevator,use,climb
689,618,LOST CONTROL ON LANDING ROLL. STOPPED UPSIDE DOWN IN A DITCH. PARKING BRAKE ON AND OR AIR IN BRAKE SYSTEM FACTORS. ,crash,has cause,emergency landing
690,619,STALLED ON NOSE HIGH CLIMB AFTER TAKEOFF. SPUN INTO TREES. FOUND ELEVATOR TRIM IN FULL NOSE UP POSITION.           ,172,subclass of,172
691,620,CRASH OCCURRED DURING EMERGENCY LANDING ATTTEMP ENGINE QUIT DUE TO WATER IN FUEL.                                  ,elevator bell,part of,elevator
692,620,CRASH OCCURRED DURING EMERGENCY LANDING ATTTEMP ENGINE QUIT DUE TO WATER IN FUEL.                                  ,elevator,has part,elevator bell
693,620,CRASH OCCURRED DURING EMERGENCY LANDING ATTTEMP ENGINE QUIT DUE TO WATER IN FUEL.                                  ,accidently released tow,subclass of,emergency landing
694,621,"PILOT FOUND CONTROLS LOCKED ON TAKEOFF. ABORTED, RAN OFF END OF RUNWAY HAD A 172 TYPE GUST LOCK IN CONTROL COLUMN. ",landing,location,runway
695,622,PAIR OF PLIERS SLID INTO ELEVATOR BELL CRANK DURING STALLS. JAMMED ELEVATOR IN FULL UP POSITION. STRUCK TREES.     ,helicopter,manufacturer,Boeing
696,623,"PILOT ACCIDENTLY RELEASED TOW AT 50 FOOT ALTITUDE, GLIDER HIT HARD DURING EMERGENCY LANDING.                       ",runway,use,landing
697,624,NOSE GEAR FORK ASSEMBLY BROKE WHEN IT HIT BERM OF CROSSING RUNWAY DURING LANDING.                                  ,load release,facet of,external load
698,625,"MADE TAKEOFF, FORGOT SLING LINE WAS ATTACHED TO DOG HOUSE. STOPPED CLIMBING AT END OF LINE. CRASHED ON DOG HOUSE.  ",latch spoilers,subclass of,glider pilot
699,626,"PILOT WAS MAKING SINGLE ENGINE APPROACH FOR LANDING, AIRCRAFT PULLED ON RUNWAY AND CRASH OCCURRED DURING GOAROUND. ",gear handle,part of,gear
700,627,CRASH OCCURRED DURING EXTERNAL LOAD PRACTICE LIFT OFF. LOAD RELEASE DID NOT FUNCTION.                              ,oil cap,part of,engine
701,628,STUDENT GLIDER PILOT FAILED TO LATCH SPOILERS PRIOR TO TAKEOFF. MISUNDERSTOOD TOW PILOT SIGNAL. RELEASED TOW.      ,runway,use,takeoff
702,629,"MISUSED AUTOPILOT.. CAUSED FULL PITCH UP. FAILED TO PULL CIRCUIT BREAKER. MISUSED GEAR HANDLE, LANDED GEAR UP.     ",fuel tank cap,has effect,fuel leak
703,630,RIGHT ENGINE OIL QUANITY DECREASED. DIVERTED TO HOUSTON. FOUND OIL CAP OFF ON RIGHT ENGINE.                        ,crashed during takeoff,item operated,elevator
704,631,CLIMB PERFORMANCE DIMINISHED BY WATER DROPLETS ON LAMINA FLOW WING. STRUCK TREES OFF END OF RUNWAY ON TAKEOFF CLIMB,left gear,has part,rudder
705,631,CLIMB PERFORMANCE DIMINISHED BY WATER DROPLETS ON LAMINA FLOW WING. STRUCK TREES OFF END OF RUNWAY ON TAKEOFF CLIMB,rudder,part of,left gear
706,632,REPORT INDICATES FUEL TANK CAP NOT SECURED. POSSIBLE FUEL LEAK DURING INVERTED FLIGHT. FIRE ERUPTED. LOST CONTROL. ,forward baggage door,subclass of,baggage
707,633,GLIDER CRASHED DURING TAKEOFF. ELEVATORS HAD NOT BEEN CONNECTED DURING ASSEMBLY.                                   ,forced,subclass of,fuel
708,634,LOST CONTROL ON LANDING. AIRPLANE TURNED SIDEWAYS AND COLLAPSED LEFT GEAR RUDDER JAMMED BY UNSTOWED STARTER CRANK. ,crash,has cause,attempted landing
709,635,"TOOK OFF WITH FORWARD BAGGAGE DOOR OPEN. TWO PIECES OF BAGGAGE FELL OUT,CARGO DOOR WARNING LIGHT INOPERATIVE.      ",Air France,country,France
710,636,RAN OUT OF FUEL EN ROUTE. SUCCESSFULL FORCED LANDING. FOUND FUEL CAP MISSING.                                      ,windshield,connects with,rear window
711,636,RAN OUT OF FUEL EN ROUTE. SUCCESSFULL FORCED LANDING. FOUND FUEL CAP MISSING.                                      ,rear window,connects with,windshield
712,637,PILOT MADE EMERGENCY TRANSMISSION STATING ENGINE COWLING LOST. CRASH OCCURRED DURING ATTEMPTED LANDING IN FIELD.   ,crash out of control,item operated,helicopter
713,638,"NOISE IN AIRCRAFT, PREPARED TO LAND IN A FIELD, FOUND POP CAN UNDER PEDALS. FLEW THRU POWERLINE. LANDED AT BASE.   ",crashed,location,river levee
714,639,"COWLING CAME OPEN IN FLIGHT, STRUCK AND LOOSENED OTHER SIDE. COWLING CAME OFF, CRACKED WINDSHIELD, REAR WINDOW.    ",cowling,part of,windshield
715,640,LONG LINE CAUGHT ON A TREE ON TAKEOFF CAUSING HELICOPTER TO CRASH OUT OF CONTROL. FAILED TO DISCONNECT LINE.       ,engine quit,has effect,emergency landing
716,641,TOW ROPE BROKE DURING CLIMB OUT AT 200 FEET. SAILPLANE CRASHED DURING ATTEMPTED LANDING ON RIVER LEVEE.            ,pilot,item operated,glider
717,641,TOW ROPE BROKE DURING CLIMB OUT AT 200 FEET. SAILPLANE CRASHED DURING ATTEMPTED LANDING ON RIVER LEVEE.            ,glider,operator,pilot
718,642,"LOOSE COWLING ON TAKEOFF. COWLING CAME OFF ON RETURNING TO LAND. CRACKED WINDSHIELD, DENTED STABILIZER.            ",parking brake,subclass of,brake
719,643,STALLED ON EMERGENCY LANDING WHEN ENGINE QUIT ON TAKEOFF. BAD MAG AND WATER IN FUEL. CORRODED UNUSED SUMP DRAIN.   ,1969 Atlantic hurricane season,point in time,1969
720,644,PILOT NEGLECTED TO CONNECT ELEVATOR CONTROL DURING GLIDER ASSEMBLY. CRASH OCCURRED DURING TAKEOFF.                 ,cargo,has part,door
721,645,"UNABLE TO OBTAIN LIFTOFF SPEED, REJECTED TAKEOFF. BRAKES CAUGHT FIRE. PASSENGER ON BRAKE OR PARKING BRAKE ON.      ",gear retraction,part of,gear up
722,646,RAN OUT OF FUEL EN ROUTE. LANDED ON A BEACH. HAD FAILED TO SECURE SUMP DRAIN ON PREFLIGHT. FUEL LEAKED OUT         ,oil cap,facet of,oil
723,647,FORWARD CARGO DOOR OPENED ON TAKEOFF. BAGGAGE HIT PROP. LANDED SAFELY. DOOR NOT PROPERLY SECURED.                  ,seat height retaining pin,part of,seat
724,648,NOSE GEAR JAMMED ON GEAR RETRACTION AFTER TAKEOFF. LANDED NOSE GEAR UP. HOMEMADE TOW BAR HAD BEEN LEFT IN WHEEL HUB,main chute,part of,reserve
725,648,NOSE GEAR JAMMED ON GEAR RETRACTION AFTER TAKEOFF. LANDED NOSE GEAR UP. HOMEMADE TOW BAR HAD BEEN LEFT IN WHEEL HUB,reserve,has part,main chute
726,649,LOST OIL PRESSURE EN ROUTE. LANDED IN AN ACTIVE RESTRICTED AREA. INDICATES OIL CAP WAS NOT SECURED.                ,nose wheel,connects with,ground pin
727,649,LOST OIL PRESSURE EN ROUTE. LANDED IN AN ACTIVE RESTRICTED AREA. INDICATES OIL CAP WAS NOT SECURED.                ,ground pin,connects with,nose wheel
728,650,PILOT SWERVED OFF RUNWAY ON TAKEOFF ROLL WHEN SEAT HEIGHT RETAINING PIN SLIPPED FROM RETAINING HOLE. SEAT DROPPED. ,tiedown,part of,trailer
729,651,PARACHUTIST WAS UNABLE TO OPEN MAIN CHUTE DUE TO BRIDLE LINE UNDER BREAST STRAP. RESERVE NOT DEPLOYED.             ,fuel starvation,has cause,fuel tank cap
730,652,NOSE WHEEL WOULD NOT RETRACT AFTER TAKEOFF. RETURNED. FOUND NOSE WHEEL GROUND PIN STILL IN PLACE.                  ,main gear,use,taxing
731,653,GROUND CREW FAILED TO UNFASTEN A SKID TIEDOWN. PILOT LOST  CONTROL ON LIFT OFF FROM A TRAILER AS THE CHAIN FAILED  ,fuselage,has part,cockpit
732,654,DOUBLE FLAMEOUT EN ROUTE DUE TO FUEL STARVATION. WORN FUEL TANK CAP FELL OFF SIPHONED FUEL. OVERSHOT FORCED LANDING,1972,point in time,1972
733,655,LEFT MAIN GEAR WENT OFF THE TAXIWAY WHILE TAXING TO RAMP. LIGHTS WERE NOT OPERATIVE IN THAT AREA.                  ,landing rollout,practiced by,pilot
734,656,PILOT UNABLE TO PRESSURIZE. FOUND ACCESS DOOR SLIGHTLY OPEN. DEPRESSURIZED. DOOR OPENED FULLY. STOPPED BY FUSELAGE.,engine,has part,fuel
735,656,PILOT UNABLE TO PRESSURIZE. FOUND ACCESS DOOR SLIGHTLY OPEN. DEPRESSURIZED. DOOR OPENED FULLY. STOPPED BY FUSELAGE.,fuel,part of,engine
736,657,NOSE GEAR COLLAPSED ON TOUCHDOWN. FOUND NOSE GEAR PINS WERE NOT HOOKED TO THE GEAR DOOR HINGE ASSEMBLY. JAMMED GEAR,runway,use,takeoff
737,658,PILOT HIT A POST ON LANDING ROLLOUT. POST LOCATED 27 FEET FROM CENTERLINE. POST HIDDEN BY SAGEBRUSH.               ,meter box,part of,float
738,659,ENGINE QUIT ON CLIMB OUT. FOUND WATER IN FUEL SUMP. NO MALFUNCTION FOUND WHEN ENGINE TESTED.                       ,seat,part of,flight
739,660,ENGINE QUIT ON TAKEOFF. STRUCK TREES ON TURNBACK TO RUNWAY.AIRPLANE SAT OUT FOR SIX MONTHS.TWO THIRDS WATER IN FUEL,1973,point in time,1973
740,661,"AFTER UNLOADING PASSENGERS, PILOT DEPARTED WITH A STEEL METER BOX ON A FLOAT. BOX FELL AND WENT THROUGH A ROOF.    ",spoilers,part of,glider
741,662,LEFT FUEL TANK SUMP DID NOT SEAT PROPERLY ON PREFLIGHT. LEAKED EXCESSIVELY DURING FLIGHT. RAN OUT OF FUEL.         ,airport,country,United States
742,663,"RIGHT ENGINE LOST OIL PRESSURE, SHUT DOWN AND RETURNED. PILOT FAILED TO SECURE TIGHT FITTING OIL CAP ON PREFLIGHT. ",oil cap,part of,engine
743,664,TOW PLANE RELEASED GLIDER AFTER LIFT OFF BECAUSE IT WOULD NOT CLIMB. GLIDER HAD SPOILERS EXTENDED.                 ,crash occurred during takeoff,participant,pilot
744,665,BAGGAGE DOOR CAME OPEN IN FLIGHT. A FILM CANISTER FELL OUT AND WENT THROUGH A ROOF. DOOR NOT PROPERLY SECURED.     ,takeoff,different from,deplaned
745,665,BAGGAGE DOOR CAME OPEN IN FLIGHT. A FILM CANISTER FELL OUT AND WENT THROUGH A ROOF. DOOR NOT PROPERLY SECURED.     ,deplaned,different from,takeoff
746,666,PILOT NOTICED BRIGHT GLOW FROM ENGINE. BELIEVED ON FIRE. SECURED AND LANDED. OIL CAP NOT SECURED.                  ,1969 Atlantic hurricane season,point in time,1969
747,667,PILOT FORGOT TO CONNECT ELEVATOR CONTROLS WHEN HE ASSEMBLED GLIDER FOR THE FLIGHT. CRASH OCCURRED DURING TAKEOFF.  ,snow berm,subclass of,aircraft
748,668,TAXING FOR TAKEOFF AIRCRAFT SLID OFF TAXIWAY. PASSENGERS DEPLANED BY PORTABLE STAIRS. TAXIWAY NOT SANDED.          ,main cargo door,subclass of,door
749,669,"ENGINE COWLING NOT PROPERLY SECURED, OPENED ON TAKEOFF.  DRAGGED A WING AND CARTWHEELED TRYING TO RETURN TO LAND.  ",airport,place served by transport hub,airport
750,670,LOST CONTROL ON TAKEOFF. LEFT WHEEL SHEARED ON A SNOW BERM. AIRCRAFT THEN SLID INTO PARKED AIRCRAFT. FROST ON WINGS,seat belt,part of,aircraft
751,671,PILOT EXPERIENCED AN UNWANTED OPENING OF THE MAIN CARGO DOOR. DOOR WAS NOT LOCKED PROPERLY. WARNING SYSTEM DEFECT. ,approach lights,part of,runway
752,672,ENGINE QUIT ON CLIMBOUT. CRASHED TWO MILES FROM AIRPORT. FOUND WATER IN FUEL AND FUEL SOURCE AT AIRPORT.           ,aileron,use,takeoff
753,673,HAD A BANGING NOISE OUTSIDE AIRCRAFT EN ROUTE. ON LANDING FOUND A SEAT BELT WAS PROTRUDING UNDER THE DOOR.         ,landing,item operated,aircraft
754,674,LONG GROUND RUN. JET WASH DAMAGED APPROACH LIGHTS AT RUNWAY DEPARTURE END. ENGINE ANTI ICE NOT USED.               ,carburetor,has part,air intake
755,674,LONG GROUND RUN. JET WASH DAMAGED APPROACH LIGHTS AT RUNWAY DEPARTURE END. ENGINE ANTI ICE NOT USED.               ,air intake,part of,carburetor
756,675,PILOT DID NOT CONNECT AILERONS DURING REASSEMBLING FOLDING WINGS. NO AILERON CONTROL DURING TAKEOFF.               ,nose gear scissors,part of,nose gear
757,676,"PILOT WAS ATTEMPTING NIGHT LANDING ON UNLIGHTED STRIP. CARLIGHTS DIRECTED WRONG WAY, AIRCRAFT LANDED SHORT.        ",oil cap,part of,engine
758,677,LOST POWER AT CRUISE ALTITUDE. LANDED ON LAKE. BROKE THROUGH ICE. FOUND RAGS IN CARBURETOR AIR INTAKE BOX.         ,cockpit,has part,ram air inlet
759,677,LOST POWER AT CRUISE ALTITUDE. LANDED ON LAKE. BROKE THROUGH ICE. FOUND RAGS IN CARBURETOR AIR INTAKE BOX.         ,ram air inlet,part of,cockpit
760,678,DEPARTED WITH NOSE GEAR SCISSORS NOT CONNECTED. AIRCRAFT VEERED OFF RUNWAY ON LANDING. NOSE GEAR COLLAPSED.        ,nosewheel fork,use,lift off
761,679,LEFT OIL PRESSURE DROPPED. SECURED ENGINE. LANDED AT NEAREST AIRPORT. LOST OIL THRU A UNSECURED OIL CAP.           ,2000,point in time,2000
762,680,SMOKE AND FUMES IN COCKPIT AFTER TAKEOFF. RETURNED. RAM AIR INLET COVER NOT REMOVED. CAUSED OVERHEATED PRESSURE AIR,cowling,part of,engine
763,681,AFTER LIFT OFF NOSE WHEEL HIT THE RUNWAY DUE TO EXCESSIVE FORWARD TRIM. IMPACT BROKE NOSEWHEEL FORK. ENGINE DAMAGED,2000,point in time,2000
764,682,TOOK OFF WITH TOW BAR STILL ATTACHED TO NOSE GEAR. TOWER ALERTED PILOT. KEPT GEAR DOWN. RETURNED.                  ,Cowling,part of,cowling
765,683,ENGINE COWLING CAME LOOSE AFTER TAKEOFF. COWLING STRUCK WINDSHIELD. RETURNED. SUSPECT COWLING NOT PROPERLY SECURED.,runway,connects with,engine
766,684,TOOK OFF WITHOUT THE REQUIRED AMOUNT OF FUEL TO REACH DESTINATION. RETURNED FOR MORE FUEL.                         ,runway,part of,aircraft
767,685,ON TAKEOFF HEARD A NOISE FOLLOWED BY A VIBRATION. RETURNED. FOUND COWLING MISSING. COWLING WAS NOT PROPERLY SECURED,forward cyclic,subclass of,collective
768,686,ENGINE QUIT ON TAKEOFF. LANDED STRAIGHT AHEAD OFF END OF RUNWAY. FUEL FILTER DRAIN PARTLY OPEN. LEAKING.           ,Faa,instance of,airspeed
769,687,PILOT ABORTED TAKEOFF BUT AIRCRAFT RAN OFF THE END OF RUNWAY. WITNESS STATED TRIM SET FULL NOSE DOWN.              ,tail rotor,followed by,main rotor
770,687,PILOT ABORTED TAKEOFF BUT AIRCRAFT RAN OFF THE END OF RUNWAY. WITNESS STATED TRIM SET FULL NOSE DOWN.              ,main rotor,follows,tail rotor
771,688,UNABLE TO USE FORWARD CYCLIC ON TAKEOFF. LOWERED COLLECTIVE. CRASH LANDED. CYCLIC RETENTION CAP BLOCKED BY LITTER. ,landing,follows,takeoff
772,689,NO AIRSPEED ON DEPARTURE. CONTINUED TO DESTINATION. FAA RAMP CHECK SHOWED PITOT PLUGGED WITH MUD. NO BIENNIAL.     ,water in fuel,subclass of,takeoff
773,690,DEPARTED LOADING PLATFORM WITH A LOADING HOSE STILL ATTACHED. CAUSED TAIL ROTOR THEN MAIN ROTORS TO STRIKE GROUND. ,approach end,part of,runway
774,691,TOW BAR ATTACHED ON TAKEOFF. BEGAN 23 LANDING WITH FRONT ENGINE FEATHERED THEN TRIED TO GO AROUND DUE TO TAILWIND. ,oil leak,has cause,lack of oil
775,691,TOW BAR ATTACHED ON TAKEOFF. BEGAN 23 LANDING WITH FRONT ENGINE FEATHERED THEN TRIED TO GO AROUND DUE TO TAILWIND. ,lack of oil,has effect,oil leak
776,692,CRASH OCCURRED IMMEDIATELY AFTER TAKEOFF WHEN ENGINE STOPPED DUE TO WATER IN FUEL.                                 ,Air France,country,France
777,693,AIRCRAFT COLLIDED WITH UNMARKED PILE OF DIRT OFF THE APPROACH END OF RUNWAY DURING NIGHT APPROACH FOR LANDING.     ,Long Island,located in the administrative territorial entity,New York
778,694,TOOK OFF AFTER AN OIL LEAK WAS CORRECTED. ENGINE SIEZED FOR LACK OF OIL. NO OTHER OIL LEAKS FOUND.                 ,intermediate position,subclass of,fuel selector
779,695,RETURNED TO AIRPORT WHEN PILOT NOTICED THAT HE DID NOT MEET MINIMUM FUEL REQUIREMENTS. FAILED TO CHECK FUEL LOAD.  ,forced landing,facet of,fuel
780,697,"ENGINE QUIT AT 600 FEET AFTER TAKEOFF. TURNED BACK TO RUNWAY, STRUCK TREES. FUEL SELECTOR IN INTERMEDIATE POSITION.",fuel siphoned out,product or material produced,fuel
781,698,MADE A FORCED LANDING DUE TO FUEL EXHAUSTION. FOUND BOTH FUEL CAPS MISSING.                                        ,crashed,participant,pilot
782,699,ASSEMBLED RUDDERVATOR INCORRECTLY. PITCH UP ON TOW. CUT LOOSE AND STALLED 45 DEGREE NOSE AND WING DOWN GROUND IMPAC,pilot,item operated,glider
783,700,RAN OUT FUEL EN ROUTE. LANDED ON A HIGHWAY. LEFT FUEL CAP IMPROPERLY SECURED. FUEL SIPHONED OUT.                   ,fuel exhaustion,has effect,forced landing
784,701,AIRCRAFT STALLED AND CRASHED WHEN PILOT RAISED FLAPS DURING GO AROUND DURING TRAINING FLIGHT.                      ,takeoff roll,subclass of,takeoff
785,702,TOW ROPE RELEASED GLIDER AT 75 FEET DURING TAKEOFF. GLIDER CRASHED WHEN PILOT TRIED 180 DEGREE TURN BACK TO RUNWAY.,tail rotor,use,landing
786,703,FUEL CAP NOT REPLACED PROPERLY BEFORE DEPARTURE. FUEL SIPHONED OUT CAUSING A FUEL EXHAUSTION FORCED LANDING..      ,landing gear,use,takeoff
787,704,LOST CONTROL OF AIRCRAFT ON THE TAKEOFF ROLL WHILE TRYING TO CLOSE A WINDOW LEFT OPEN PRIOR TO TAKEOFF.            ,fuel,part of,engine
788,705,SUPPORT STRAPS CARRIED IN OPEN SLING LOAD BUCKET BLEW INTO TAIL ROTOR DURING DESCENT FOR LANDING. LOST TAIL CONTROL,2003,point in time,2003
789,706,FUEL CAP LEFT OFF. RETURNED AFTER TAKEOFF. FORGOT TO LOWER LANDING GEAR. PILOT NOT COOPERATIVE IN THE INVESTIGATION,sumping,part of,fueling
790,707,REFUELED AIRCRAFT WITH WRONG FUEL. CAPTAIN WAS WATCHING. ROUGH ENGINE ON CLIMB OUT. RETURNED.                      ,oil changed,product or material produced,oil
791,708,SLUGGISH PERFORMANCE ON TOW. CUT LOOSE BUT UNABLE TO MAKE AIRPORT. HAD FAILED TO RETRACT SPOILERS FOR TAKEOFF.     ,passenger,has part,pilot
792,709,LOST POWER ON DOWNWIND FOR LANDING. HIT TREES. INDICATES FUEL CONTAMINATION THE PROBLEM.IMPROPER FUELING OR SUMPING,seat not fastened prior takeoff,facet of,takeoff
793,710,OIL PRESSURE DROPPED. OIL COVERED THE WINDSHIELD.MADE EMERGENCY LANDING. HAD OIL CHANGED. FAILED TO SECURE OIL CAP.,cockpit,part of,birds
794,711,PILOT STATES PASSENGER OPENED BAGGAGE DOOR AND DID NOT CLOSE IT PROPERLY. DOOR CAME OPEN ON TAKEOFF.               ,seat belt,has part,control stick
795,712,PILOTS SEAT SLID BACK ON TAKEOFF. CONTROL WAS LOST. VEERED OFF RUNWAY INTO A POND. SEAT NOT FASTENED PRIOR TAKEOFF.,final approach,follows,takeoff
796,712,PILOTS SEAT SLID BACK ON TAKEOFF. CONTROL WAS LOST. VEERED OFF RUNWAY INTO A POND. SEAT NOT FASTENED PRIOR TAKEOFF.,takeoff,followed by,final approach
797,713,SMOKE IN COCKPIT. MADE HARD LANDING DUE TO ANXIETY TO RETURN. DAMAGED PROP AND WING TIP. BIRDS NEST ON CYLINDERS.  ,2000,point in time,2000
798,714,USED SEAT BELT TO HOLD CONTROL STICK BACK. FORGOT TO RELEASE. STALLED ON TAKEOFF. FELL BACK TO RUNWAY.             ,tail rotor,part of,helicopter
799,715,AIRCRAFT CRASHED ON FINAL APPROACH AS PILOT WAS RETURNING AFTER COWLING CAME LOOSE AFTER TAKEOFF.                  ,aborted,subclass of,takeoff
800,716,CIRCUIT BREAKER TRIPPED ON GEAR RETRACTION. MADE PRECAUTIONARY LANDING. TOWBAR HAD BEEN LEFT IN NOSE WHEEL.        ,helicopter,use,takeoff
801,717,GROUND CREW PUT SLING ON HOOK INSTEAD OF IN HELICOPTER AS PILOT INDICATED. FOULED TAIL ROTOR. CAUSED A CRASH.      ,landingon,subclass of,tractor
802,718,LOADED PALLET SHIFTED REARWARD ON TAKEOFF ROLL. AIRCRAFT NOSED UP. FLIGHT WAS ABORTED OFF RUNWAY. LOCKS NOT SECURED,runway,use,takeoff
803,719,LONG LINE CAUGHT ON TREES AS HELICOPTER CLIMBED AFTER TAKEOFF. HAD NEGLECTED RELEASE LINE FOR THE PASSENGER FLIGHT.,seatbelt,connects with,pedestal
804,719,LONG LINE CAUGHT ON TREES AS HELICOPTER CLIMBED AFTER TAKEOFF. HAD NEGLECTED RELEASE LINE FOR THE PASSENGER FLIGHT.,pedestal,connects with,seatbelt
805,720,ENGINE QUIT AT 300 FT ON TAKEOFF. STRUCK A TRACTOR LANDINGON NEARBY AG STRIP. WATER IN BLADDER FUEL TANK WRINKLES. ,parking brake,subclass of,brakes
806,721,LEFT WING BAGGAGE DOOR DAME OPEN ON TAKEOFF ROLL. ABORTED BUT UNABLE TO STOP ON WET SLUSH. RAN OFF END OF RUNWAY.  ,airport,located in or next to body of water,mud
807,722,HAD CYCLIC CONTROL PROBLEMS. FOUND CENTER SEAT BUCKLE HAD LODGED BETWEEN THE RIGHT CYCLIC CONTROL AND THE PEDESTAL.,takeoff,followed by,liftoff
808,723,PILOT FAILED TO COMPLETELY RELEASE PARKING BRAKE PRIOR TO FLIGHT. BRAKES LOCKED ON LANDING. AIRCRAFT NOSED OVER.   ,doorlocked,part of,door
809,724,ENGINE QUIT WHILE APPROACHING AIRPORT. LANDED SHORT IN MUD AND FLIPPED OVER. MUD DAUBERS HAD BLOCKED FUEL VENTS.   ,oil cap,part of,engine
810,725,AIRCRAFT SETTLED BACK INTO GROUND DURING TAKEOFF. INDICATIONS ARE THAT FLAPS WERE RAISED TOO SOON AFTER LIFTOFF.   ,powerplant,has part,fuel system
811,725,AIRCRAFT SETTLED BACK INTO GROUND DURING TAKEOFF. INDICATIONS ARE THAT FLAPS WERE RAISED TOO SOON AFTER LIFTOFF.   ,fuel system,part of,powerplant
812,726,LOUD BANG NEAR ENGINE. ABORTED TAKE OFF. NOSE BAGGAGE DOORLOCKED BUT OPEN. BRACKET THAT HOLDS DOOR WAS BROKEN.     ,main gear,subclass of,gear
813,727,HIGH ITT AND LOW OIL PRESSURE ON BOTH ENGINES ON APPROACH. FOUND BOTH OIL CAPS IN PLACE BUT NOT LOCKED DOWN.       ,crashed,has cause,takeoff
814,728,PARTIAL POWERPLANT FAILURE. LANDED IN A PASTURE. FOUND EXCESSIVE WATER IN FUEL SYSTEM.                             ,altitude preselect,use,takeoff
815,729,PAVEMENT UNDER LEFT MAIN GEAR GAVE WAY. GEAR GOT CAUGHT. BOLTS ATTACHING GEAR TO WING SHEARED OFF.                 ,2000,point in time,2000
816,730,AIRCRAFT CRASHED WHEN RIGHT ENGINE QUIT DURING TAKEOFF. RIGHT FUEL TANK EMPTY AND SHOWED SIGNS OF CONTAMINATION.   ,fuel exhaustion,location,fuel sump
817,731,ALTITUDE PRESELECT IMPROPERLY SET BEFORE TAKEOFF. LEVELED OFF TOO LOW. DESCENDED SLIGHTLY AND IMPACTED TREES.      ,icing,subclass of,ice ingestion
818,732,TOOK OFF WITH A TOW BAR ATTACHED TO THE NOSE GEAR. JAMMED THE NOSE GEAR DOOR. LANDED WITH NOSE GEAR UP.            ,fuselage,has part,belly drain
819,732,TOOK OFF WITH A TOW BAR ATTACHED TO THE NOSE GEAR. JAMMED THE NOSE GEAR DOOR. LANDED WITH NOSE GEAR UP.            ,belly drain,part of,fuselage
820,733,LANDED ON A ROAD DUE TO FUEL EXHAUSTION 30 MINUTES AFTER TAKEOFF. SUSPECT FUEL SUMP FROZE IN OPEN POSITION         ,Taxiway,subclass of,aircraft
821,734,LOST BOTH ENGINES ON TAKEOFF DUE TO ICE INGESTION. CREW IGNORED AIRFRAME PRIOR ICING. FAILED TO CHECK ENGINE INLETS,left wing,use,landing
822,735,ENGINE MALFUNCTION ON INITIAL CLIMBOUT. FOUND WATER AND FINE DIRT PARTICLES IN STRAINER AND FUSELAGE BELLY DRAIN.  ,seat belt,has part,rear control stick
823,736,TAXIWAY GAVE WAY ALLOWING WHEEL OF AIRCRAFT TO DROP IN HOLE CAUSING SUBSTANTIAL DAMAGE TO AIRCRAFT.                ,rear seat belt,has part,rear control stick
824,737,"FAILED TO CLEAN MUD FROM BRAKES ON PREFLIGHT. RIGHT BRAKE FROZE IN FLIGHT. SWERVED ON LANDING, DAMAGED LEFT WING.  ",fog,has part,snow
825,738,CRASHED SHORTLY AFTER LIFTOFF. FOUND REAR CONTROL STICK SECURED IN FULL AFT POSITION BY THE SEAT BELT.             ,precautionary landing,subclass of,land on road
826,739,PILOT DID NOT REMOVE REAR SEAT BELT WHICH HELD REAR CONTROL STICK FROM MOVING WHILE AIRCRAFT WAS PARKED.           ,cord drag,has cause,heater cord
827,740,LOADED NEAR GROSS AND ICE ON AIRFRAME STRUCK TREES OFF DEPARTURE END OF RUNWAY. DARK NIGHT FOG AND SNOW SHOWERS.   ,pilot,item operated,prop
828,741,CRASH OCCURRED DURING PRECAUTIONARY LANDING WHEN PILOT ATTEMPTED TO LAND ON ROAD TO SECURE OIL ACCESS COVER.       ,crashed,has cause,takeoff
829,742,INDICATES HEATER CORD NOT DISCONNECTED PRIOR TO LIFTOFF. ATTACHED CORD DRAG WHICH BROKE AND WHITEOUT WERE FACTORS  ,flaps,use,takeoff
830,743,CABIN DOOR OPENED. BLEW OFF AS PILOT TRIED TO CLOSE IT. HIS HAND BLEW INTO PROP INJURING A FINGER. DOOR NOT SECURED,runway,part of,airport
831,744,AIRCRAFT STALLED AND CRASHED DURING TAKEOFF. SEVERAL WITNESSES NOTICED FROST ON WINGS.                             ,carburetor,part of,engine
832,745,PILOT USING FLAPS FOR TAKEOFF HIT WIRES WHEN ADDITIONAL FLAPS WERE APPLIED AND REDUCED PERFORMANCE.                ,nose gear collapse,subclass of,gear indication
833,746,"UNABLE TO CLIMB OR SUSTAIN SPEED AFTER TAKEOFF. CRASH LANDED OFF AIRPORT.SNOW, ICE AND SLUSH ON AIRCRAFT AND RUNWAY",emergency landing,location,airport
834,747,LOST ENGINE POWER AT CRUISE ALTITUDE. CARBURETOR HEAT APPLIED. WATER DRAINED FROM FUEL SYSTEM.                     ,failed,has effect,takeoff
835,748,DURING PREFLIGHT PILOT GOT A FAULTY GEAR INDICATION; DECIDED TO ATTEMPT FLIGHT RESULTING IN NOSE GEAR COLLAPSE.    ,fuel,part of,runway
836,749,CRASH OCCURRED DURING EMERGENCY LANDING ON AIRPORT AFTER LOSS OF OIL PRESSURE ON LEFT ENGINE.OIL LOW IN LEFT ENGINE,taxiing,followed by,takeoff
837,750,ENGINE FAILED AFTER TAKEOFF. TRIED TO MAKE A ROAD BUT DRIFTED OFF THE EDGE. FOUND SOLID ICE IN CARBURETOR BOWL.    ,aileron,use,takeoff
838,751,RAN OUT OF FUEL APPROACHING DESTINATION. LANDED ON THE RUNWAY. FUEL SIPHONED FROM LOOSE FUEL CAP.                  ,Cowl,has part,cowl halves
